{
  "$schema": "https://json-schema.org/draft/2020-12/schema",
  "title": "SEO Agent Handoff Payload",
  "description": "Minimum contract for passing work from one SEO agent to another and recording consumption.",
  "type": "object",
  "additionalProperties": false,
  "required": [
    "handoff_id",
    "from_agent",
    "to_agent",
    "reason",
    "context_summary",
    "evidence_refs",
    "requested_action",
    "risk_level",
    "acceptance_criteria",
    "due_trigger",
    "source_node_id",
    "target_node_id",
    "status",
    "receiving_output_id",
    "receiving_node_id",
    "consumed_at",
    "unresolved_reason"
    ,"resolution",
    "terminal_receipt"
  ],
  "properties": {
    "handoff_id": {"type": "string"},
    "from_agent": {"type": "string"},
    "to_agent": {"type": "string"},
    "reason": {"type": "string"},
    "context_summary": {"type": "string"},
    "evidence_refs": {"type": "array", "items": {"type": "string"}},
    "requested_action": {"type": "string"},
    "risk_level": {
      "type": "string",
      "enum": ["Critical", "High", "Medium", "Low"]
    },
    "acceptance_criteria": {"type": "array", "items": {"type": "string"}},
    "due_trigger": {"type": "string"},
    "source_node_id": {"type": "string"},
    "target_node_id": {"type": "string"},
    "status": {
      "type": "string",
      "enum": ["CREATED", "CONSUMED", "BLOCKED"]
    },
    "receiving_output_id": {"type": "string"},
    "receiving_node_id": {"type": "string"},
    "consumed_at": {"type": "string"},
    "unresolved_reason": {"type": "string"},
    "resolution": {"enum": ["PENDING", "ACCEPTED", "CHALLENGED", "UNRESOLVED"]},
    "terminal_receipt": {
      "type": "string",
      "pattern": "^$|^[0-9a-f]{64}$",
      "description": "Deterministic integrity receipt for terminal runtime fields; not an identity or external trust signature."
    }
  },
  "allOf": [
    {
      "if": {"properties": {"status": {"const": "CREATED"}}},
      "then": {
        "properties": {
          "resolution": {"const": "PENDING"},
          "terminal_receipt": {"maxLength": 0}
        }
      }
    },
    {
      "if": {"properties": {"status": {"const": "CONSUMED"}}},
      "then": {
        "properties": {
          "resolution": {"enum": ["ACCEPTED", "CHALLENGED"]},
          "receiving_output_id": {"minLength": 1},
          "receiving_node_id": {"minLength": 1},
          "terminal_receipt": {"minLength": 64}
        }
      }
    },
    {
      "if": {"properties": {"status": {"const": "BLOCKED"}}},
      "then": {
        "properties": {
          "resolution": {"const": "UNRESOLVED"},
          "unresolved_reason": {"minLength": 1},
          "terminal_receipt": {"minLength": 64}
        }
      }
    }
  ],
  "examples": [
    {
      "handoff_id": "handoff-technical-to-engineer-001",
      "from_agent": "SEO Technical Agent",
      "to_agent": "Senior SEO Engineer Agent",
      "reason": "Template-level canonical bug requires code implementation.",
      "context_summary": "Localized product pages emit canonical URLs pointing to the US version.",
      "evidence_refs": ["tech-001", "crawl-export-2026-07-03.csv"],
      "requested_action": "Patch product template canonical generation and add regression test.",
      "risk_level": "High",
      "acceptance_criteria": ["Localized sample URLs self-canonicalize", "Existing US product URLs unchanged"],
      "due_trigger": "Before international sitemap resubmission",
      "source_node_id": "technical-analysis",
      "target_node_id": "engineering-implementation",
      "status": "CREATED",
      "receiving_output_id": "",
      "receiving_node_id": "",
      "consumed_at": "",
      "unresolved_reason": ""
      ,"resolution": "PENDING",
      "terminal_receipt": ""
    }
  ]
}
